{
  "Records": [
    {
      "EventSource": "aws:sns",
      "EventVersion": "1.0",
      "EventSubscriptionArn": "arn:aws:sns:eu-west-1:241797080087:mbvideography-mail-receive-Topic-OMDBMU4SJYWH:5ad3f686-ebe6-4a18-a7b0-c55f974ab49a",
      "Sns": {
        "Type": "Notification",
        "MessageId": "7403faf7-a40b-5a44-896b-afab6f76cc63",
        "TopicArn": "arn:aws:sns:eu-west-1:241797080087:mbvideography-mail-receive-Topic-OMDBMU4SJYWH",
        "Subject": "Amazon SES Email Receipt Notification",
        "Message": "{\"notificationType\":\"Received\",\"mail\":{\"timestamp\":\"2019-05-20T15:35:24.673Z\",\"source\":\"tobia.zorzan@gmail.com\",\"messageId\":\"1on77tf7l9cdp01sf5a7be4o4709dj75s2i382g1\",\"destination\":[\"info@mbvideography.com\"],\"headersTruncated\":false,\"headers\":[{\"name\":\"Return-Path\",\"value\":\"<tobia.zorzan@gmail.com>\"},{\"name\":\"Received\",\"value\":\"from mail-vs1-f48.google.com (mail-vs1-f48.google.com [209.85.217.48]) by inbound-smtp.eu-west-1.amazonaws.com with SMTP id 1on77tf7l9cdp01sf5a7be4o4709dj75s2i382g1 for info@mbvideography.com; Mon, 20 May 2019 15:35:24 +0000 (UTC)\"},{\"name\":\"X-SES-Spam-Verdict\",\"value\":\"PASS\"},{\"name\":\"X-SES-Virus-Verdict\",\"value\":\"PASS\"},{\"name\":\"Received-SPF\",\"value\":\"pass (spfCheck: domain of _spf.google.com designates 209.85.217.48 as permitted sender) client-ip=209.85.217.48; envelope-from=tobia.zorzan@gmail.com; helo=mail-vs1-f48.google.com;\"},{\"name\":\"Authentication-Results\",\"value\":\"amazonses.com; spf=pass (spfCheck: domain of _spf.google.com designates 209.85.217.48 as permitted sender) client-ip=209.85.217.48; envelope-from=tobia.zorzan@gmail.com; helo=mail-vs1-f48.google.com; dkim=pass header.i=@gmail.com; dmarc=pass header.from=gmail.com;\"},{\"name\":\"X-SES-RECEIPT\",\"value\":\"AEFBQUFBQUFBQUFIYUNobVhVREJWZE4vMlVvYVM1ZHU3MDlFdEFzZ2FWTXV5TGNvUjI0bnNuOGliZEllQzdPQzNvcmpFQnI1QnlaRHl2bDNnZkxvdlo2Rk9UZC9qeFBXSkFDcmV0OFpjaTRDNFFVWkF6ckJiTnNwdW5DYmxwdUJuOE4vSzlscnF6UmRCbzNUMjBLZmxxM20vOXZXOUo5RWg1cyt3ZUU5TEU4Y3h0aWtNaHpabk5FSlVrdmlxWjkxQzhuT2U3azFKT0E0Tzl2aldPOWY1OTdYYVROV1RWbjBNSEtySm1yRGFlTld0S284Q1ZITStGZE9TU1IycHI3MkRSalZDMHVBYXRNUDJPVjJRV096KzJoRmNvU3VEc1VOL0hzTERmL25OM09yN2JVbkowSmRGYkE9PQ==\"},{\"name\":\"X-SES-DKIM-SIGNATURE\",\"value\":\"a=rsa-sha256; q=dns/txt; b=K4Vmf4wm6k9qq8igarmjHSSmqVtB5hAuJ3MV86t0RvTuqhbBhyUlDdexesHEv97OjmqUKVh1A18Uu+IyMLOaEQxCGoxC4OEnr2w3xarZ+0m/6DhLIRU2zp31qmry9AaTv15l2PgjevZt9I3ObUmYxLWF8N4QZwOEeTZAfbE/90E=; c=relaxed/simple; s=ihchhvubuqgjsxyuhssfvqohv7z3u4hn; d=amazonses.com; t=1558366524; v=1; bh=2HlmxbKCVyT9zZPPOoy3Gn0/HTUkdJkbv/8S5PSOOJU=; h=From:To:Cc:Bcc:Subject:Date:Message-ID:MIME-Version:Content-Type:X-SES-RECEIPT;\"},{\"name\":\"Received\",\"value\":\"by mail-vs1-f48.google.com with SMTP id x8so5245560vsx.13 for <info@mbvideography.com>; Mon, 20 May 2019 08:35:24 -0700 (PDT)\"},{\"name\":\"DKIM-Signature\",\"value\":\"v=1; a=rsa-sha256; c=relaxed/relaxed; d=gmail.com; s=20161025; h=mime-version:from:date:message-id:subject:to; bh=2HlmxbKCVyT9zZPPOoy3Gn0/HTUkdJkbv/8S5PSOOJU=; b=NqodVQB7IrjIcvTMRMWtZgso2Y+et0PrKwuYB3drop0QTFacou8mEVelJQ4GsIAPtLUzRhcW6xkLaJn7SEtg2iMFuuDxg+ArKZnc28M6bRa6W5Su0dNjCzpW2KJVwwVRWFH2ioOGUyEwglLBMgwNGwikCs3AQhBjtjiSySl8Fu1b3KDwj7mU+6RFh3eyjUM/JCvP1GTHXPIVaJfWmVX40F3chLUSOhLBe3+VG/lS+sleDadLgwA+fNXCE+e89rdLU7kjV3iIlFEJNSA04yPOCqpftXT1JUT1ByvtN4N8k/ucXchbSoPckURzH2KRTZQPih3rkoB4sozGmeXbgaOnVg==\"},{\"name\":\"X-Google-DKIM-Signature\",\"value\":\"v=1; a=rsa-sha256; c=relaxed/relaxed; d=1e100.net; s=20161025; h=x-gm-message-state:mime-version:from:date:message-id:subject:to; bh=2HlmxbKCVyT9zZPPOoy3Gn0/HTUkdJkbv/8S5PSOOJU=; b=jmDO+KoFENVpVouGxtl9yQ8ZNhdHv82MPWX3fDHut/LUlexdKgiQz9MPrXbkUm/xM/ 9qRxsUXe3mqBNnhQHKheECNjMaFkX56PxWSYR+QeN2oyzvlFqvefSoUUQwojOvZFXgX1 WKWU86mtufytmyONqRVrl7VNtAwbwSorSZXk2YPgpGmvmlkX5OZIzExv3h7EK7s434Lr WUkEHVOA4y+XSRQGcIE1w364Da1av/Q3gpuQthRAHMZoH5xq1AQ4iaRvVJIsp0QShDy8 sEbbBXQPLsookxnE0Vtg/SMzE6LHWyoR8UxELIVBSz9njLP9gtQA7mI6cIdVmzh9PjLF KwzQ==\"},{\"name\":\"X-Gm-Message-State\",\"value\":\"APjAAAXEwabua9ZzB1M3hEUn1hd8TLBHehvs58qqB67J4zsOhwzjg77G jizT7SaOAWPJm+40OvIVrCG/QJeChvLzwXt8TxMkASgF\"},{\"name\":\"X-Google-Smtp-Source\",\"value\":\"APXvYqzSTCaBx3Chu1gTI+RRYmmuE1e808RAQzilzJ3OzI+FTzrHdQy/S4fEeoUvpvXd6ZmVlpz9+gqgqrcp13T3qB4=\"},{\"name\":\"X-Received\",\"value\":\"by 2002:a67:ea42:: with SMTP id r2mr7017175vso.207.1558366523212; Mon, 20 May 2019 08:35:23 -0700 (PDT)\"},{\"name\":\"MIME-Version\",\"value\":\"1.0\"},{\"name\":\"From\",\"value\":\"Tobia Zorzan <tobia.zorzan@gmail.com>\"},{\"name\":\"Date\",\"value\":\"Mon, 20 May 2019 17:35:12 +0200\"},{\"name\":\"Message-ID\",\"value\":\"<CAPXsmB9_wJ4ESbsLmdgTj4gFiDz5xQZTn-EEcWEZHhtjkfowAA@mail.gmail.com>\"},{\"name\":\"Subject\",\"value\":\"Test message\"},{\"name\":\"To\",\"value\":\"info@mbvideography.com\"},{\"name\":\"Content-Type\",\"value\":\"multipart/alternative; boundary=\\\"0000000000000bc8240589537b46\\\"\"}],\"commonHeaders\":{\"returnPath\":\"tobia.zorzan@gmail.com\",\"from\":[\"Tobia Zorzan <tobia.zorzan@gmail.com>\"],\"date\":\"Mon, 20 May 2019 17:35:12 +0200\",\"to\":[\"info@mbvideography.com\"],\"messageId\":\"<CAPXsmB9_wJ4ESbsLmdgTj4gFiDz5xQZTn-EEcWEZHhtjkfowAA@mail.gmail.com>\",\"subject\":\"Test message\"}},\"receipt\":{\"timestamp\":\"2019-05-20T15:35:24.673Z\",\"processingTimeMillis\":320,\"recipients\":[\"info@mbvideography.com\"],\"spamVerdict\":{\"status\":\"PASS\"},\"virusVerdict\":{\"status\":\"PASS\"},\"spfVerdict\":{\"status\":\"PASS\"},\"dkimVerdict\":{\"status\":\"PASS\"},\"dmarcVerdict\":{\"status\":\"PASS\"},\"action\":{\"type\":\"SNS\",\"topicArn\":\"arn:aws:sns:eu-west-1:241797080087:mbvideography-mail-receive-Topic-OMDBMU4SJYWH\",\"encoding\":\"UTF8\"}},\"content\":\"Return-Path: <tobia.zorzan@gmail.com>\\r\\nReceived: from mail-vs1-f48.google.com (mail-vs1-f48.google.com [209.85.217.48])\\r\\n by inbound-smtp.eu-west-1.amazonaws.com with SMTP id 1on77tf7l9cdp01sf5a7be4o4709dj75s2i382g1\\r\\n for info@mbvideography.com;\\r\\n Mon, 20 May 2019 15:35:24 +0000 (UTC)\\r\\nX-SES-Spam-Verdict: PASS\\r\\nX-SES-Virus-Verdict: PASS\\r\\nReceived-SPF: pass (spfCheck: domain of _spf.google.com designates 209.85.217.48 as permitted sender) client-ip=209.85.217.48; envelope-from=tobia.zorzan@gmail.com; helo=mail-vs1-f48.google.com;\\r\\nAuthentication-Results: amazonses.com;\\r\\n spf=pass (spfCheck: domain of _spf.google.com designates 209.85.217.48 as permitted sender) client-ip=209.85.217.48; envelope-from=tobia.zorzan@gmail.com; helo=mail-vs1-f48.google.com;\\r\\n dkim=pass header.i=@gmail.com;\\r\\n dmarc=pass header.from=gmail.com;\\r\\nX-SES-RECEIPT: AEFBQUFBQUFBQUFIYUNobVhVREJWZE4vMlVvYVM1ZHU3MDlFdEFzZ2FWTXV5TGNvUjI0bnNuOGliZEllQzdPQzNvcmpFQnI1QnlaRHl2bDNnZkxvdlo2Rk9UZC9qeFBXSkFDcmV0OFpjaTRDNFFVWkF6ckJiTnNwdW5DYmxwdUJuOE4vSzlscnF6UmRCbzNUMjBLZmxxM20vOXZXOUo5RWg1cyt3ZUU5TEU4Y3h0aWtNaHpabk5FSlVrdmlxWjkxQzhuT2U3azFKT0E0Tzl2aldPOWY1OTdYYVROV1RWbjBNSEtySm1yRGFlTld0S284Q1ZITStGZE9TU1IycHI3MkRSalZDMHVBYXRNUDJPVjJRV096KzJoRmNvU3VEc1VOL0hzTERmL25OM09yN2JVbkowSmRGYkE9PQ==\\r\\nX-SES-DKIM-SIGNATURE: a=rsa-sha256; q=dns/txt; b=K4Vmf4wm6k9qq8igarmjHSSmqVtB5hAuJ3MV86t0RvTuqhbBhyUlDdexesHEv97OjmqUKVh1A18Uu+IyMLOaEQxCGoxC4OEnr2w3xarZ+0m/6DhLIRU2zp31qmry9AaTv15l2PgjevZt9I3ObUmYxLWF8N4QZwOEeTZAfbE/90E=; c=relaxed/simple; s=ihchhvubuqgjsxyuhssfvqohv7z3u4hn; d=amazonses.com; t=1558366524; v=1; bh=2HlmxbKCVyT9zZPPOoy3Gn0/HTUkdJkbv/8S5PSOOJU=; h=From:To:Cc:Bcc:Subject:Date:Message-ID:MIME-Version:Content-Type:X-SES-RECEIPT;\\r\\nReceived: by mail-vs1-f48.google.com with SMTP id x8so5245560vsx.13\\r\\n        for <info@mbvideography.com>; Mon, 20 May 2019 08:35:24 -0700 (PDT)\\r\\nDKIM-Signature: v=1; a=rsa-sha256; c=relaxed/relaxed;\\r\\n        d=gmail.com; s=20161025;\\r\\n        h=mime-version:from:date:message-id:subject:to;\\r\\n        bh=2HlmxbKCVyT9zZPPOoy3Gn0/HTUkdJkbv/8S5PSOOJU=;\\r\\n        b=NqodVQB7IrjIcvTMRMWtZgso2Y+et0PrKwuYB3drop0QTFacou8mEVelJQ4GsIAPtL\\r\\n         UzRhcW6xkLaJn7SEtg2iMFuuDxg+ArKZnc28M6bRa6W5Su0dNjCzpW2KJVwwVRWFH2io\\r\\n         OGUyEwglLBMgwNGwikCs3AQhBjtjiSySl8Fu1b3KDwj7mU+6RFh3eyjUM/JCvP1GTHXP\\r\\n         IVaJfWmVX40F3chLUSOhLBe3+VG/lS+sleDadLgwA+fNXCE+e89rdLU7kjV3iIlFEJNS\\r\\n         A04yPOCqpftXT1JUT1ByvtN4N8k/ucXchbSoPckURzH2KRTZQPih3rkoB4sozGmeXbga\\r\\n         OnVg==\\r\\nX-Google-DKIM-Signature: v=1; a=rsa-sha256; c=relaxed/relaxed;\\r\\n        d=1e100.net; s=20161025;\\r\\n        h=x-gm-message-state:mime-version:from:date:message-id:subject:to;\\r\\n        bh=2HlmxbKCVyT9zZPPOoy3Gn0/HTUkdJkbv/8S5PSOOJU=;\\r\\n        b=jmDO+KoFENVpVouGxtl9yQ8ZNhdHv82MPWX3fDHut/LUlexdKgiQz9MPrXbkUm/xM/\\r\\n         9qRxsUXe3mqBNnhQHKheECNjMaFkX56PxWSYR+QeN2oyzvlFqvefSoUUQwojOvZFXgX1\\r\\n         WKWU86mtufytmyONqRVrl7VNtAwbwSorSZXk2YPgpGmvmlkX5OZIzExv3h7EK7s434Lr\\r\\n         WUkEHVOA4y+XSRQGcIE1w364Da1av/Q3gpuQthRAHMZoH5xq1AQ4iaRvVJIsp0QShDy8\\r\\n         sEbbBXQPLsookxnE0Vtg/SMzE6LHWyoR8UxELIVBSz9njLP9gtQA7mI6cIdVmzh9PjLF\\r\\n         KwzQ==\\r\\nX-Gm-Message-State: APjAAAXEwabua9ZzB1M3hEUn1hd8TLBHehvs58qqB67J4zsOhwzjg77G\\r\\n\\tjizT7SaOAWPJm+40OvIVrCG/QJeChvLzwXt8TxMkASgF\\r\\nX-Google-Smtp-Source: APXvYqzSTCaBx3Chu1gTI+RRYmmuE1e808RAQzilzJ3OzI+FTzrHdQy/S4fEeoUvpvXd6ZmVlpz9+gqgqrcp13T3qB4=\\r\\nX-Received: by 2002:a67:ea42:: with SMTP id r2mr7017175vso.207.1558366523212;\\r\\n Mon, 20 May 2019 08:35:23 -0700 (PDT)\\r\\nMIME-Version: 1.0\\r\\nFrom: Tobia Zorzan <tobia.zorzan@gmail.com>\\r\\nDate: Mon, 20 May 2019 17:35:12 +0200\\r\\nMessage-ID: <CAPXsmB9_wJ4ESbsLmdgTj4gFiDz5xQZTn-EEcWEZHhtjkfowAA@mail.gmail.com>\\r\\nSubject: Test message\\r\\nTo: info@mbvideography.com\\r\\nContent-Type: multipart/alternative; boundary=\\\"0000000000000bc8240589537b46\\\"\\r\\n\\r\\n--0000000000000bc8240589537b46\\r\\nContent-Type: text/plain; charset=\\\"UTF-8\\\"\\r\\n\\r\\nTest mail for notification\\r\\n\\r\\nCheers\\r\\n\\r\\n--0000000000000bc8240589537b46\\r\\nContent-Type: text/html; charset=\\\"UTF-8\\\"\\r\\n\\r\\n<div dir=\\\"ltr\\\">Test mail for notification<br clear=\\\"all\\\"><div><br></div>Cheers</div>\\r\\n\\r\\n--0000000000000bc8240589537b46--\\r\\n\"}",
        "Timestamp": "2019-05-20T15:35:25.008Z",
        "SignatureVersion": "1",
        "Signature": "TA5dz79OscemXMDN30Km0ifCEfud1KHc16WLsBKJm7PF1XW1c45SJ92EOMtaF5GON5InGEMKxFrpo5/ix3juxgvuysEgERJsNItk9r5Vse4PTse50dRkIVIymXVPIpnMSASrvObMQriYQamTnzqB3H/ap1iYtdxaSTnUJ12lOs2XFC8DlR/zxIVxmJPAOV9CbGM8vWRzRX5i0S0gY1Q6CskTsHjDiqH/wXRCUcVF+GXd5lQQrp90ZsAPplO+B2BEhxTkkTQz1Bc7ECTbvKEyfUi9m5FAXjdPo6bHj/gGuioCQn2SnBh7uN2SWyICgnwm8pu2Y8HSWEh2Q2d1kld9UA==",
        "SigningCertUrl": "https://sns.eu-west-1.amazonaws.com/SimpleNotificationService-6aad65c2f9911b05cd53efda11f913f9.pem",
        "UnsubscribeUrl": "https://sns.eu-west-1.amazonaws.com/?Action=Unsubscribe&SubscriptionArn=arn:aws:sns:eu-west-1:241797080087:mbvideography-mail-receive-Topic-OMDBMU4SJYWH:5ad3f686-ebe6-4a18-a7b0-c55f974ab49a",
        "MessageAttributes": {}
      }
    }
  ]
}
